{"type":"config","name":"Optimize zsh startup with zsh-bench","metricName":"first_prompt_lag_ms","metricUnit":"ms","bestDirection":"lower"}
{"run":1,"commit":"90c05f2","metric":27.894,"metrics":{"first_command_lag_ms":689.543,"command_lag_ms":175.074,"input_lag_ms":4.986,"exit_time_ms":334.448},"status":"keep","description":"Baseline zsh-bench direct because hey zbench flag forwarding rejects --iters","timestamp":1779680486268,"segment":0,"confidence":null,"asi":{"note":"hey zbench --iters 4 failed due Nushell unknown flag; direct zsh-bench used for exploratory baseline"}}
{"run":2,"commit":"90c05f2","metric":28.97,"metrics":{"first_command_lag_ms":692.291,"command_lag_ms":164.515,"input_lag_ms":5.036,"exit_time_ms":325.781},"status":"discard","description":"Simplify antidote static health check and remove duplicate bun completion source; also tried Nu --wrapped flag forwarding","timestamp":1779680562306,"segment":0,"confidence":null,"asi":{"decision":"zshrc change not kept: first_prompt and first_command regressed/noise; command_lag improved but not enough alone. Harness --wrapped did not fix hey zbench --iters in current invocation."}}
{"run":3,"commit":"90c05f2","metric":30.985,"metrics":{"first_command_lag_ms":723.437,"command_lag_ms":172.199,"input_lag_ms":5.391,"exit_time_ms":334.161},"status":"discard","description":"Remove duplicate unconditional bun completion source only","timestamp":1779680651666,"segment":0,"confidence":null,"asi":{"decision":"Discarded: duplicate bun completion source removal did not improve primary or first_command in this run."}}
{"run":4,"commit":"90c05f2","metric":31.97,"metrics":{"first_command_lag_ms":698.871,"command_lag_ms":170.993,"input_lag_ms":4.819,"exit_time_ms":326.829},"status":"discard","description":"Simplify _cache to avoid command mtime checks for cached command-generated snippets","timestamp":1779680715588,"segment":0,"confidence":null,"asi":{"decision":"Discarded: primary and first_command lag regressed; input_lag improved slightly but not enough."}}
{"run":5,"commit":"90c05f2","metric":29.321,"metrics":{"first_command_lag_ms":681.929,"command_lag_ms":171.383,"input_lag_ms":4.83,"exit_time_ms":319.545},"status":"discard","description":"Defer fzf shell integration via antidote kind:defer","timestamp":1779680782722,"segment":0,"confidence":null,"asi":{"decision":"Discarded for now: first_command/command/input improved somewhat but primary first_prompt lag regressed vs baseline; fzf keybinding behavior may also become delayed. Cache bundle regenerated during experiment and should be restored."}}
{"run":6,"commit":"90c05f2","metric":28.6,"metrics":{"first_command_lag_ms":681.0,"command_lag_ms":168.5,"input_lag_ms":5.2,"exit_time_ms":325.7},"status":"keep","description":"Fix repo zbench harness to forward flags with Nushell def --wrapped [...args]; validated with ./bin/hey zbench --iters 4","timestamp":1779680903441,"segment":0,"confidence":null,"asi":{"note":"Shell performance roughly noise vs direct baseline; kept because it fixes requested exploratory command. Installed hey on PATH still points to previous generation until rebuild, so used ./bin/hey for validation."}}
{"run":7,"commit":"52d45bb","metric":31.9,"metrics":{"first_command_lag_ms":995.3,"command_lag_ms":172.2,"input_lag_ms":4.9,"exit_time_ms":0},"status":"discard","description":"Undefer zsh-vi-mode to test whether deferred loading causes high first_command_lag","timestamp":1779681065382,"segment":0,"confidence":null,"asi":{"decision":"Discarded: first_prompt and especially first_command lag regressed substantially. Hypothesis disproven; keep zsh-vi-mode deferred. zbench-report tail omitted exit_time_ms in run_experiment output, logged 0 placeholder."}}
{"run":8,"commit":"52d45bb","metric":30.5,"metrics":{"first_command_lag_ms":686,"command_lag_ms":162,"input_lag_ms":2.5,"exit_time_ms":0},"status":"discard","description":"Delay heavy deferred plugins (zsh-vi-mode, atuin, autopair) by 1s with antidote defer-options","timestamp":1779681432966,"segment":0,"confidence":null,"asi":{"decision":"Discarded: command/input lag improved, but first_prompt_lag regressed vs baseline and first_command stayed about the same. This also delays expected interactive features by a full second, so not worth keeping."}}
{"run":9,"commit":"52d45bb","metric":28.9,"metrics":{"first_command_lag_ms":658.5,"command_lag_ms":175.8,"input_lag_ms":5,"exit_time_ms":0},"status":"discard","description":"Limit powerlevel10k antidote bundle to powerlevel10k.zsh-theme instead of sourcing both powerlevel10k and powerlevel9k theme files","timestamp":1779681492137,"segment":0,"confidence":null,"asi":{"decision":"Discarded for now: first_command improved, but first_prompt was worse than best/baseline and command_lag regressed slightly. Need confirmation if revisited because this may be a real behavior-preserving cleanup but current primary metric did not improve."}}
{"run":10,"commit":"52d45bb","metric":30.6,"metrics":{"first_command_lag_ms":701.6,"command_lag_ms":180.9,"input_lag_ms":4.9,"exit_time_ms":0},"status":"discard","description":"Remove manual background autopair-init block because zsh-autopair auto-initializes when its deferred source runs","timestamp":1779681546552,"segment":0,"confidence":null,"asi":{"decision":"Discarded: expected to remove redundant background work, but first_prompt, first_command, and command_lag all regressed. Keep current explicit background block for now."}}
{"run":11,"commit":"52d45bb","metric":30.2,"metrics":{"first_command_lag_ms":695.1,"command_lag_ms":170.1,"input_lag_ms":5.3,"exit_time_ms":0},"status":"discard","description":"Remove duplicate fpath append for zsh completions from completion.zsh because .zshrc already prepends the same directory before compinit","timestamp":1779681595234,"segment":0,"confidence":null,"asi":{"decision":"Discarded: duplicate fpath cleanup preserved behavior in principle, but primary first_prompt_lag regressed and no secondary metric improved meaningfully versus baseline."}}
{"run":12,"commit":"52d45bb","metric":29.8,"metrics":{"first_command_lag_ms":740.2,"command_lag_ms":175.6,"input_lag_ms":4.8,"exit_time_ms":0},"status":"discard","description":"Source zcompiled Antidote static bundle when .zsh_plugins.zsh.zwc is newer than static bundle","timestamp":1779681661215,"segment":0,"confidence":null,"asi":{"decision":"Discarded: using a zcompiled static bundle regressed first_prompt and first_command lag versus baseline. Not worth adding extra cache invalidation complexity."}}
{"run":13,"commit":"52d45bb","metric":31.3,"metrics":{"first_command_lag_ms":694.7,"command_lag_ms":165.4,"input_lag_ms":5.2,"exit_time_ms":0},"status":"discard","description":"Always use compinit -C with zcompdump cache instead of daily full compinit -i refresh","timestamp":1779681729634,"segment":0,"confidence":null,"asi":{"decision":"Discarded: removing the daily refresh/check path regressed first_prompt_lag and did not materially improve first_command/input. Also weakens completion self-healing, so not worth keeping."}}
{"run":14,"commit":"52d45bb","metric":31.6,"metrics":{"first_command_lag_ms":951.2,"command_lag_ms":187.2,"input_lag_ms":4.9,"exit_time_ms":0},"status":"discard","description":"Remove deferred zsh-vi-mode plugin to test if it is responsible for first_command_lag and command_lag","timestamp":1779681802549,"segment":0,"confidence":null,"asi":{"decision":"Discarded: removing zsh-vi-mode regressed first_prompt, first_command, and command_lag substantially. This suggests zsh-vi-mode is not the cause of measured command lag; keep it deferred to preserve behavior."}}
{"run":15,"commit":"52d45bb","metric":32.9,"metrics":{"first_command_lag_ms":783.6,"command_lag_ms":183.4,"input_lag_ms":5,"exit_time_ms":0},"status":"discard","description":"Enable Powerlevel10k instant prompt in custom prompt config by setting POWERLEVEL9K_INSTANT_PROMPT=quiet","timestamp":1779681859588,"segment":0,"confidence":null,"asi":{"decision":"Discarded: despite existing instant-prompt sourcing block, enabling it in the custom prompt config regressed first_prompt, first_command, and command_lag. Keep instant prompt off for this prompt."}}
{"run":16,"commit":"52d45bb","metric":31.4,"metrics":{"first_command_lag_ms":759.1,"command_lag_ms":174.6,"input_lag_ms":4.9,"exit_time_ms":0},"status":"discard","description":"Stop sourcing generated .p10k.zsh before extra.zshrc because active prompt.zsh is loaded later and reloads p10k","timestamp":1779681938927,"segment":0,"confidence":null,"asi":{"decision":"Discarded: plausible duplicate prompt config cleanup, but first_prompt, first_command, and command_lag all regressed versus baseline. Keep current .p10k.zsh source order until a better prompt-loading redesign is tested."}}
{"run":17,"commit":"52d45bb","metric":28.6,"metrics":{"first_command_lag_ms":691.4,"command_lag_ms":172.5,"input_lag_ms":5,"exit_time_ms":0},"status":"discard","description":"Remove deferred atuin plugin to test if atuin shell integration contributes to early command lag","timestamp":1779681992584,"segment":0,"confidence":null,"asi":{"decision":"Discarded: removing atuin did not improve first_prompt versus the best baseline and first_command/command_lag stayed in the same range. It also disables expected history integration, so not worth keeping."}}
{"run":18,"commit":"52d45bb","metric":31.3,"metrics":{"first_command_lag_ms":974.9,"command_lag_ms":179.6,"input_lag_ms":2.7,"exit_time_ms":0},"status":"discard","description":"Delay heavy deferred plugins by 0.2s with antidote defer-options to reduce first-command contention without visibly delaying features","timestamp":1779682068599,"segment":0,"confidence":null,"asi":{"decision":"Discarded: input_lag improved, but first_prompt and especially first_command lag regressed substantially. Short delay appears to push plugin work into the benchmark's first-command window rather than avoiding it."}}
{"run":19,"commit":"52d45bb","metric":29.6,"metrics":{"first_command_lag_ms":698.2,"command_lag_ms":173.2,"input_lag_ms":5.1,"exit_time_ms":0},"status":"discard","description":"Remove fzf shell integration entirely to diagnose whether fzf completion/keybindings contribute to startup or command lag","timestamp":1779682127486,"segment":0,"confidence":null,"asi":{"decision":"Discarded: removing fzf did not improve primary first_prompt_lag or secondary command metrics enough, and it disables expected Ctrl-T/Alt-C/fzf integration. Keep fzf loaded normally."}}
{"run":20,"commit":"52d45bb","metric":29.1,"metrics":{"first_command_lag_ms":684.4,"command_lag_ms":166.9,"input_lag_ms":2.8,"exit_time_ms":0},"status":"discard","description":"Remove deferred fast-syntax-highlighting to diagnose whether syntax highlighting contributes to input/command lag","timestamp":1779682190275,"segment":0,"confidence":null,"asi":{"decision":"Discarded: input_lag improved materially, but removing syntax highlighting is a visible feature loss and primary first_prompt_lag did not beat baseline. First_command/command lag remained in the same range, so not worth keeping."}}
{"run":21,"commit":"52d45bb","metric":28.3,"metrics":{"first_command_lag_ms":672.4,"command_lag_ms":152.4,"input_lag_ms":4.5,"exit_time_ms":0},"status":"discard","description":"Remove deferred zsh-autosuggestions to diagnose whether autosuggestion widget work contributes to command/input lag","timestamp":1779682240488,"segment":0,"confidence":null,"asi":{"decision":"Discarded: command_lag improved, but primary first_prompt did not beat the best baseline and removing autosuggestions is a visible feature loss. Keep autosuggestions deferred."}}
{"run":22,"commit":"52d45bb","metric":29.5,"metrics":{"first_command_lag_ms":668.9,"command_lag_ms":164.7,"input_lag_ms":4.8,"exit_time_ms":0},"status":"discard","description":"Remove deferred zsh-history-substring-search to diagnose whether history substring widgets contribute to command/input lag","timestamp":1779682289300,"segment":0,"confidence":null,"asi":{"decision":"Discarded: first_command improved slightly, but primary first_prompt_lag regressed and removing history substring search breaks expected Up/Down substring history behavior configured in keybinds.zsh."}}
{"run":23,"commit":"52d45bb","metric":26.5,"metrics":{"first_command_lag_ms":666.1,"command_lag_ms":156,"input_lag_ms":4.7,"exit_time_ms":0},"status":"keep","description":"Switch zsh-autosuggestions strategy from completion to history to reduce autosuggestion work while preserving suggestions","timestamp":1779682341046,"segment":0,"confidence":1.161666666666666,"asi":{"decision":"Kept provisionally: this is the first run beating primary baseline and improves first_command/command/input versus baseline while preserving autosuggestions, though semantics change from completion-based suggestions to history-based suggestions. Needs confirmation rerun before finalizing."}}
{"run":24,"commit":"52d45bb","metric":32.1,"metrics":{"first_command_lag_ms":689.6,"command_lag_ms":167.5,"input_lag_ms":4.8,"exit_time_ms":0},"status":"discard","description":"Confirmation rerun for autosuggestions history strategy using repo ZDOTDIR explicitly","timestamp":1779682411262,"segment":0,"confidence":1.0723076923076904,"asi":{"decision":"Discarded confirmation: the previous history-strategy win did not reproduce when benchmarking with repo ZDOTDIR explicitly. Primary first_prompt_lag regressed versus baseline and first_command returned to baseline range, so do not keep this semantics-changing autosuggestion strategy change based on one noisy run."}}
{"run":25,"commit":"52d45bb","metric":30.5,"metrics":{"first_command_lag_ms":659.6,"command_lag_ms":155,"input_lag_ms":4.8,"exit_time_ms":0},"status":"discard","description":"Set ZSH_AUTOSUGGEST_MANUAL_REBIND=1 while keeping completion strategy to avoid autosuggestions rebinding widgets on every precmd","timestamp":1779682490143,"segment":0,"confidence":1.161666666666666,"asi":{"decision":"Discarded: first_command and command_lag improved, but primary first_prompt_lag regressed versus baseline. Behavior risk is moderate because manual rebind can miss widgets added later, so not worth keeping without primary improvement."}}
{"run":26,"commit":"52d45bb","metric":30.9,"metrics":{"first_command_lag_ms":701,"command_lag_ms":161.3,"input_lag_ms":4.9,"exit_time_ms":0},"status":"discard","description":"Lower ZSH_AUTOSUGGEST_BUFFER_MAX_SIZE from 30 to 15 while keeping completion strategy","timestamp":1779682549000,"segment":0,"confidence":1.2121739130434783,"asi":{"decision":"Discarded: smaller autosuggestion buffer did not improve primary or first_command lag, despite modest command_lag improvement. It also reduces suggestions for moderately long commands."}}
{"run":27,"commit":"worktree/h798-precmd","metric":35.7,"metrics":{"first_command_lag_ms":895.4,"command_lag_ms":204.4,"input_lag_ms":5.3,"exit_time_ms":424.2},"status":"keep","description":"Baseline rerun before hook-focused profiling","timestamp":"2026-05-25T14:21:52Z","asi":{"note":"precmd inventory included zsh-jj precmd_vcs_info; manual timing found it dominates command_lag."}}
{"run":28,"commit":"worktree/h798-precmd","metric":37.3,"metrics":{"first_command_lag_ms":515.6,"command_lag_ms":39.7,"input_lag_ms":5.7,"exit_time_ms":401.4},"status":"keep","description":"Remove unused rkh/zsh-jj plugin; active prompt uses custom async jj segment","timestamp":"2026-05-25T14:40:00Z","asi":{"decision":"Kept: removes precmd_vcs_info from prompt loop. command_lag improved from ~204ms to 40-51ms across confirmation runs."}}
{"run":29,"commit":"worktree/h798-precmd","metric":37.9,"metrics":{"first_command_lag_ms":532.4,"command_lag_ms":54.1,"input_lag_ms":5.4,"exit_time_ms":429.6},"status":"keep","description":"Add Antidote static bundle invalidation when .zsh_plugins.txt is newer","timestamp":"2026-05-25T14:45:00Z","asi":{"decision":"Kept: preserves behavior of plugin-list edits and keeps zsh-jj removal effective without manual cache deletion; benchmark remains in improved command_lag band."}}
